{
  "schema_version": "2.0.0-sc05-proposal",
  "synthetic_validation_sample": true,
  "synthetic_notice": "SYNTHETIC VALIDATION SAMPLE ONLY — NOT A MEASURED BENCHMARK RUN. Used exclusively in WP-00 to test sc05_benchmark_v2.json and validate_sc05_v2.py.",
  "run_id": "SYNTHETIC-SAMPLE-20261024T175000Z-lenobox-s11-sc05_oracle",
  "experiment_id": "EXP-0005",
  "work_package": "WP-00",
  "git_provenance": {
    "branch": "experiment/exp-0005-wp00-contracts",
    "commit_sha": "b91c9faa81287e570e66c45a117e34623b13c110",
    "dirty": false,
    "command_line": "python3 experiments/EXP-0005-scientific-simulation-substrates/scripts/validate_sc05_v2.py --allow-synthetic-sample",
    "environment_variables": {
      "PYTHONHASHSEED": "0"
    }
  },
  "backend_provenance": {
    "backend_name": "sc05_analytic_oracle",
    "backend_variant": "stdlib_fp64_scalar_oracle",
    "version_tag": "wp00-1.0.0",
    "source_sha": "b91c9faa81287e570e66c45a117e34623b13c110",
    "license": "Apache-2.0",
    "build_system": null,
    "compiler": null,
    "compiler_flags": null,
    "python_version": "3.14.4",
    "package_lock_sha256": null
  },
  "hardware_environment": {
    "host": "lenobox",
    "os_kernel": "Linux 7.0.0-31-generic x86_64",
    "virtualization": "none",
    "cpu_model": "AMD Ryzen 5 PRO 5650GE with Radeon Graphics",
    "physical_cores": 6,
    "logical_threads": 12,
    "parallel_workers_used": 1,
    "mem_total_bytes": 15570395136,
    "mem_available_start_bytes": 13356437504,
    "mem_available_end_bytes": 13355388928,
    "swap_used_start_bytes": 2289127424,
    "swap_used_end_bytes": 2289127424
  },
  "workload_identity": {
    "workload_id": "sc05/disconnected/v1",
    "workload_instance_id": "3673c2f0835d4a0e78dc23e88b528eb00b967428dc215e8ffebfdf761f63aa2d",
    "seed": 11,
    "rng_stream_id": "SplitMix64-deterministic-v1:seed=11",
    "config_path": "experiments/EXP-0005-scientific-simulation-substrates/fixtures/manifest_sha256.json",
    "config_sha256": "55c4b37bcfb1ead48c1be514f428fb20da08d8253d3eb21d340f6a72fc02a258",
    "edges_fixture_sha256": "88ab14d356a2cf40def0d18cdaab7154aabf24d30300473aeed17f507ee77462",
    "events_fixture_sha256": "27eace633b48892f9170c69f232c9a8321e06818ca8bb93f9fbcdded32fa0103",
    "adapted_input_sha256": "27eace633b48892f9170c69f232c9a8321e06818ca8bb93f9fbcdded32fa0103",
    "historical_exp0004_triple": null
  },
  "model_semantics": {
    "comparison_tier": "Tier-A-analytic",
    "semantic_classification": "equivalent-exact",
    "equation_signature": "dV/dt = -(V - E_L)/tau_ms; tau_ms=10.0, E_L=0.0, V_th=1.0, V_reset=0.0, tau_ref=2.0",
    "solver_kind": "continuous_time_analytic_event_driven",
    "dt_ms": null,
    "precision": "fp64",
    "threshold_policy": "instantaneous_on_event_arrival_tol_1e-10",
    "refractory_policy": "half_open_[t_spike, t_spike + 2.0ms)_clamped_to_0mV",
    "delay_rounding_policy": "exact_fp64_no_grid_rounding",
    "tie_break_policy": "(t_ms, target_id, src_id, ordinal)",
    "plasticity_mode": "off",
    "history_capacity_depth": 0,
    "monitor_policy": "detailed_state_and_spikes"
  },
  "scale_and_activity_metrics": {
    "allocated_neurons_N": 128,
    "allocated_edges_M": 512,
    "allocated_compartments": null,
    "active_neurons_count": 32,
    "active_participation_definition": "neurons_receiving_at_least_one_committed_impulse_event",
    "external_events_injected": 64,
    "committed_spikes": 27,
    "synapse_deliveries": 108,
    "neuron_integration_steps": null,
    "scheduler_processed_events": 172,
    "rolled_back_events": null,
    "reexecuted_events": null,
    "committed_events": 172
  },
  "lifecycle_timing": {
    "simulated_horizon_ms": 100.0,
    "compile_or_codegen_wall_s": null,
    "network_construction_wall_s": 0.0004,
    "first_call_prep_wall_s": null,
    "steady_simulation_wall_s": 0.0012,
    "readout_wall_s": 0.0001,
    "total_end_to_end_wall_s": 0.0017,
    "warmup_repetitions": 0,
    "measured_repetitions": 1,
    "rep_steady_simulation_wall_s": [0.0012],
    "confidence_method": "synthetic_single_sample_not_a_benchmark",
    "throughput_value": 143333.33333333334,
    "throughput_denominator_definition": "committed_events / steady_simulation_wall_s",
    "simulated_sec_per_wall_sec": 83.33333333333333
  },
  "resource_and_safety": {
    "peak_rss_bytes": 24117248,
    "rss_measurement_method": "getrusage_ru_maxrss_kib_to_bytes",
    "incremental_rss_bytes": 1048576,
    "safety_cap_bytes": 6442450944,
    "oom_killed": false,
    "swap_breach_aborted": false,
    "timeout_aborted": false,
    "exit_status": 0
  },
  "validation_and_fidelity": {
    "oracle_passed": true,
    "timestamp_monotonicity_passed": true,
    "backward_time_committed_events": 0,
    "output_trace_sha256": "84852a45266df385e64f684e57795b45dc6703ff8227a8cf83f44bd6bc023b31",
    "spike_precision": 1.0,
    "spike_recall": 1.0,
    "spike_time_mae_ms": 0.0,
    "spike_time_p95_ms": 0.0,
    "membrane_rmse_mv": 0.0,
    "parity_claim_with_exp0004": false
  },
  "missing_or_unsupported_fields": {
    "backend_provenance.build_system": "not-applicable-pure-python-stdlib-oracle",
    "backend_provenance.compiler": "not-applicable-pure-python-stdlib-oracle",
    "backend_provenance.compiler_flags": "not-applicable-pure-python-stdlib-oracle",
    "backend_provenance.package_lock_sha256": "not-applicable-stdlib-only",
    "workload_identity.historical_exp0004_triple": "not-applicable-native-sc05-fixture",
    "model_semantics.dt_ms": "not-applicable-continuous-time-analytic-solver",
    "scale_and_activity_metrics.allocated_compartments": "not-applicable-point-neuron-lif-model",
    "scale_and_activity_metrics.neuron_integration_steps": "not-applicable-event-driven-analytic-extrapolation",
    "scale_and_activity_metrics.rolled_back_events": "not-applicable-sequential-non-optimistic-solver",
    "scale_and_activity_metrics.reexecuted_events": "not-applicable-sequential-non-optimistic-solver",
    "lifecycle_timing.compile_or_codegen_wall_s": "not-applicable-no-code-generation",
    "lifecycle_timing.first_call_prep_wall_s": "not-applicable-no-separate-first-call-preprocessing"
  },
  "external_artifacts": []
}
